{
    "summary_text": "Summary:\nFull-stack developer with 5+ years of experience in JavaScript, React, and Node.js. Passionate about building scalable web applications.",
    "skills": [
        "JavaScript",
        "Node.js",
        "Python",
        "React",
        "SQL"
    ],
    "education_details": [
        {
            "degree_mention": "bs",
            "institution_mention": "Stanford University",
            "date_mention": "2018",
            "text": "Education: B.S. in Computer Science, Stanford University (2018)"
        }
    ],
    "contact_info": {
        "emails": [
            "alex.johnson@email.com"
        ],
        "phones": [
            "5551234567"
        ]
    },
    "experience": [
        {
            "job_title": "Senior Software Engineer",
            "company": "Google",
            "start_date": "2021-01-01",
            "end_date": "2025-05-17",
            "description": "Led a team to build a customer dashboard using React and Redux.\nImproved API response time by 30% by optimizing backend queries."
        },
        {
            "job_title": "Software Developer",
            "company": "Pinterest",
            "start_date": "2018-01-01",
            "end_date": "2021-01-01",
            "description": ""
        }
    ],
    "total_years_experience": 7.4,
    "education_level": 3,
    "raw_entities": {
        "PERSON": [
            "Alex Johnson\nEmail",
            "github.com/alexjohnson"
        ],
        "CARDINAL": [
            "123",
            "2018–2021",
            "2021",
            "555"
        ],
        "DATE": [
            "5+ years"
        ],
        "ORG": [
            "B.S. in Computer Science",
            "Google",
            "JavaScript",
            "Node.js and Express",
            "Pinterest",
            "Python",
            "SQL",
            "Stanford University (2018"
        ],
        "GPE": [
            "React",
            "Redux"
        ],
        "PERCENT": [
            "30%"
        ]
    },
    "companies": [
        "Google",
        "Node.js and Express",
        "Pinterest"
    ],
    "raw_text_snippet": "Software Engineer\nName: Alex Johnson\nEmail: alex.johnson@email.com | Phone: (555) 123-4567\nLinkedIn: linkedin.com/in/alexjohnson | GitHub: github.com/alexjohnson\nSummary:\nFull-stack developer with 5+ years of experience in JavaScript, React, and Node.js. Passionate about building scalable web applications.\nExperience:\nSenior Software Engineer, Google (2021–Present)\nLed a team to build a customer dashboard using React and Redux.\nImproved API response time by 30% by optimizing backend queries.\nSoftware Developer, Pinterest (2018–2021)\nDeveloped RESTful APIs using Node.js and Express.\nSkills: JavaScript, React, Node.js, Python, SQL\nEducation: B.S. in Computer Science, Stanford University (2018)"
}