{
    "summary_text": "Summary:\nDigital marketing expert with 7+ years of experience in SEO, content strategy, and social media campaigns.",
    "skills": [
        "Google Ads",
        "SEO"
    ],
    "education_details": [
        {
            "degree_mention": "mba",
            "institution_mention": "Business University",
            "date_mention": "2016",
            "text": "Education: MBA in Marketing, Business University (2016)"
        }
    ],
    "contact_info": {
        "emails": [
            "sarah.williams@email.com"
        ],
        "phones": [
            "5559876543"
        ]
    },
    "experience": [
        {
            "job_title": "Marketing Manager",
            "company": "Coca Cola",
            "start_date": "2020-01-01",
            "end_date": "2025-05-17",
            "description": ""
        },
        {
            "job_title": null,
            "company": "Digital Marketer",
            "start_date": "2016-01-01",
            "end_date": "2020-01-01",
            "description": ""
        }
    ],
    "total_years_experience": 9.4,
    "education_level": 4,
    "raw_entities": {
        "PERSON": [
            "Sarah Williams\nEmail"
        ],
        "CARDINAL": [
            "2016–2020",
            "555",
            "987"
        ],
        "ORG": [
            "Business University",
            "Coca Cola",
            "Content Marketing",
            "Digital",
            "Digital Marketer",
            "Facebook",
            "Facebook Ads",
            "Google",
            "Google Ads",
            "SEO",
            "Unilever"
        ],
        "DATE": [
            "2020",
            "7+ years"
        ],
        "PERCENT": [
            "50%"
        ]
    },
    "companies": [
        "Coca Cola",
        "Digital Marketer",
        "Facebook",
        "Google",
        "SEO"
    ],
    "raw_text_snippet": "Marketing Manager\nName: Sarah Williams\nEmail: sarah.williams@email.com | Phone: (555) 987-6543\nLinkedIn: linkedin.com/in/sarahwilliams\nSummary:\nDigital marketing expert with 7+ years of experience in SEO, content strategy, and social media campaigns.\nExperience:\nMarketing Manager, Coca Cola (2020–Present)\nIncreased organic traffic by 50% through SEO optimization.\nManaged a $100K/month ad budget on Google and Facebook.\nDigital Marketer, Unilever (2016–2020)\nRan successful influencer marketing campaigns.\nSkills: SEO, Google Ads, Facebook Ads, Content Marketing\nEducation: MBA in Marketing, Business University (2016)"
}