{
    "summary_text": null,
    "skills": [
        "BI",
        "Data Analysis",
        "Excel (Advanced)",
        "Git",
        "Machine Learning",
        "Matplotlib",
        "MySQL",
        "NumPy",
        "Pandas",
        "PostgreSQL",
        "Power BI",
        "Python",
        "R",
        "SQL",
        "SQL Server",
        "Scikit-learn",
        "Seaborn",
        "Statistical Modeling",
        "Tableau"
    ],
    "education_details": [
        {
            "degree_mention": null,
            "institution_mention": "Northwestern University",
            "date_mention": null,
            "text": "Northwestern University, Evanston, IL"
        },
        {
            "degree_mention": null,
            "institution_mention": "Bachelor of Arts in Economics",
            "date_mention": null,
            "text": "Bachelor of Arts in Economics"
        },
        {
            "degree_mention": null,
            "institution_mention": "University of Illinois Urbana-Champaign",
            "date_mention": null,
            "text": "University of Illinois Urbana-Champaign, Urbana, IL"
        }
    ],
    "contact_info": {
        "emails": [
            "c.danvers.stats@protonmail.com"
        ]
    },
    "experience": [],
    "total_years_experience": 0.0,
    "education_level": 4,
    "raw_entities": {
        "PERSON": [
            "Carol Danvers",
            "Git",
            "Jupyter Notebooks",
            "Seaborn"
        ],
        "ORG": [
            "Bachelor of Arts in Economics\nUniversity of Illinois Urbana-Champaign",
            "IL\nGraduation",
            "IL\nStart Date:",
            "IL\nStart Date: 07/2020",
            "Numbers Inc.",
            "Power BI\n- Statistical Modeling: Regression Analysis",
            "Quantify Corp",
            "SQL",
            "Scikit",
            "Skills Summary\n- Data Analysis & Visualization: Python",
            "Time Series Forecasting"
        ],
        "PRODUCT": [
            "Matplotlib",
            "Server"
        ],
        "GPE": [
            "Chicago",
            "Evanston",
            "Tableau",
            "Urbana"
        ],
        "MONEY": [
            "50k"
        ],
        "DATE": [
            "Dec 2017",
            "May 2020",
            "annually"
        ],
        "CARDINAL": [
            "01/2022"
        ]
    },
    "companies": [],
    "raw_text_snippet": "Carol Danvers\nc.danvers.stats@protonmail.com\nSkills Summary\n- Data Analysis & Visualization: Python (Pandas, NumPy, Matplotlib, Seaborn), R, SQL, Tableau, Power BI\n- Statistical Modeling: Regression Analysis, Time Series Forecasting, Hypothesis Testing\n- Machine Learning (Basic): Scikit-learn\n- Databases: MySQL, PostgreSQL, SQL Server\n- Tools: Excel (Advanced), Jupyter Notebooks, Git\nExperience\nData Analyst | Quantify Corp | Chicago, IL\nStart Date: 02/2022 End Date: Present\n- Perform data extraction, cleaning, and analysis to identify key business insights.\n- Develop dashboards and reports to visualize data and communicate findings to stakeholders.\n- Contributed to a project that identified operational inefficiencies, saving the company $50"
}